Reed College,Private,OR,"will announce fall plans by June 30",Waiting to decide,https://www.reed.edu/coronavirus/communications/may-1-2020-plans-for-reeds-fall-semester.html
Regis University,Private,CO,"planning on starting and ending fall semester early",Planning for in-person,https://www.regis.edu/news/2020/05/fall-semester-to-start-early
Reformed Theological Seminary,Private,Multiple,"expects to be in-person",Planning for in-person,https://rts.edu/news/news-institutional/rts-announces-plans-for-fall-2020-classes/
Rensselaer Polytechnic Institute,Private,NY,"waiting to decide",Waiting to decide,https://covid19.rpi.edu/announcements/hands-experiences
Rhodes College,Private,TN,"will share plans by May 27",Waiting to decide,https://t.e2ma.net/message/b27m7b/f9nntxb
Rice University,Private,TX,"planning a shortened semester with a hybrid approach",Proposing a hybrid model,https://www.ricethresher.org/article/2020/05/leebron-announces-plan-for-fall-semester
Roanoke College,Private,VA,"plans to resume in-person instruction",Planning for in-person,https://www.roanoke.edu/about/news/maxey_message_fall_2020
Rochester Institute of Technology,Private,NY,"“optimistic” about being open for fall",Planning for in-person,https://www.rit.edu/news/eyes-fall-time-creativity
Rockhurst University,Private,MO,"planning a "traditional" start to fall semester/",Planning for in-person,https://twitter.com/RockhurstU/status/1255932257950486528
Roger Williams University,Private,RI,"planning for in-person",Planning for in-person,https://pbn.com/rwu-working-on-protocols-to-reopen-campus-in-the-fall/
Rollins College,Private,FL,"expects fall programs to be “running normally”",Planning for in-person,https://emergency.rollins.edu/covid19/
Rutgers University,Public,NJ,"operating remotely",Considering a range of scenarios,https://nbchancellor.rutgers.edu/status
Sacred Heart University,Private,CT,"planning for in-person",Planning for in-person,https://www.sacredheart.edu/offices--departments-directory/health-services/coronavirus/
Sarah Lawrence College,Private,NY,"plans to begin fall semester as scheduled, while exploring a number of scenarios for accomplishing that ",Considering a range of scenarios,https://www.sarahlawrence.edu/status/covid/#accordion-2-1-1-4
Saint Francis University,Private,PA,"intends to return students to campus in the fall",Planning for in-person,https://www.francis.edu/coronavirus-updates/
Saint Leo University,Private,FL,"will decide in the summer",Waiting to decide,saintleo.edu/coronavirus
Saint Mary's College,Private,IN,"plans to reopen in the fall",Planning for in-person,https://www.saintmarys.edu/emergency-info
Samford University,Private,AL,"href="https://www.samford.edu/news/2020/04/Samford-Announces-Plans--Fall-2020">plans to resume on-campus classes and reopen residence halls for the fall 2020 semester",Planning for in-person
San Jose State University,Public,CA,"planning to offer online and hybrid courses",Proposing a hybrid model,https://www.mercurynews.com/2020/04/22/sjsu-cal-state-east-bay-considering-hybrid-of-online-and-in-person-classes-for-fall/
Santa Monica College,Private,CA,"will hold fall classes online",Planning for in-person,http://www.smc.edu/ACG/Superintendent-President/Message/Pages/Fall-2020-Update-Watch-We-Miss-You.aspx
Santa Rosa Junior College,Public,CA,"will continue remote instruction through the fall semester",Planning for online,https://www.santarosa.edu/
Schreiner University,Private,TX,"planning for in-person fall classes",Planning for in-person,https://schreiner.edu/news-schreiner-university-announces-plans-for-fall-2020/
Seattle University,Private,WA,"intends to reopen campus in the fall",Planning for in-person,https://www.seattleu.edu/newsroom/stories/seattle-university-intends-to-re-open-for-fall-quarter.html
Seton Hall University,Private,NJ,"“We have a team in place finalizing plans for our collective return to campus in the fall,” but contingency plans are being made “to ensure we are prepared should the science or government guidance delay a return or require modified approaches.”",Planning for in-person,https://www.shu.edu/health-intervention-communication/coronavirus-campus-communications.cfm#april27
Shenandoah University,Private,VA,"plans to make a decision by around July 1",Waiting to decide,https://www.virginiabusiness.com/article/fall-semester-on-the-minds-of-virginias-colleges-and-universities/
Siena Heights University,Private,MI,"plan",Planning for in-person,https://sienaheights.edu/Siena-Heights-News/ArtMID/2940/ArticleID/710/Siena-Heights-University-Fall-2020-Opening-Statement
Sierra College,Public,CA,"announced via Twitter that classes will be remote",Planning for online,https://twitter.com/SierraCollege/status/1254807916701298688
Simmons University,Private,MA,"planning a hybrid model ",Proposing a hybrid model,https://www.simmons.edu/news/simmons-university-announces-comprehensive-online-undergraduate-experience
Simpson College,Private,IA,"intends to have in-person fall classes",Planning for in-person,https://simpson.edu/covid19
Simpson University,Private,CA,"planning for in-person",Planning for in-person,https://simpsonunews.com/2020/05/05/simpson-university-announces-intention-to-reopen-campus-in-fall-20/
South Dakota School of Mines and Technology,Public,SD,"planning for in-person",Planning for in-person,https://www.sdsmt.edu/News/Mines-Returns-to-In-Person-Classes-in-Fall-2020/#.Xrxe-S-z1hF
Southeastern Oklahoma State University,Public,OK,"intends to return to in-person instruction in the fall",Planning for in-person,https://www.se.edu/2020/05/new-southeastern-president-begins-duties-will-form-task-force-to-plan-for-return-to-regular-classes-in-the-fall/
Southern Methodist University,Private,TX,"plans to reopen campus in the fall",Planning for in-person,https://blog.smu.edu/coronavirus-covid-19/2020/04/30/we-intend-to-be-open-in-fall-2020/
Southern New Hampshire University,Private,NH,"planning to allow students to move into dorms, and is offering full tuition scholarships to incoming freshmen",Planning for in-person,https://www.snhu.edu/about-us/newsroom/2020/04/full-tuition-scholarships-for-incoming-freshmen
Southern Utah University,Public,UT,"plans to offer both in-person and online classes in the fall",Proposing a hybrid model,https://www.suu.edu/news/2020/02/coronavirus-health-notice.html
Southwest Baptist University,Private,MO,"planning for in-person",Planning for in-person,https://bolivarmonews.com/free/let-there-be-life/article_11d6e50e-91a1-11ea-b50e-d34ba7f9a711.html
Southwestern Baptist Theological Seminary,Private,TX,"planning to have on-campus instruction",Planning for in-person,https://swbts.edu/news/releases/southwestern-seminary-announces-plans-resume-campus-instruction-fall/
Southwestern Oklahoma State University,Public,OK,"Intends to resume in-person classes in the fall",Planning for in-person,https://www.swosu.edu/news/releases/2020/2020-05-04b.aspx
St. John Fisher College,Private,NY,"planning to reopen in the fall",Planning for in-person,https://www.wxxinews.org/post/rochester-area-colleges-begin-planning-fall-reopening?fbclid=IwAR3avK0DvFMs9nSax-gIGeCeGEA14H5lEgJVYCBxJPuBd30lqJCSo8WGVTE
St. Louis University,Private,MO,"planning a gradual reopening",Planning for in-person,https://www.ksdk.com/article/news/education/saint-louis-university-plan-fall-semester/63-7ef4d9d7-1048-42fb-8aeb-56b3c499f266
St. Mary’s College of California,Private,CA,"“We are planning to welcome students back to campus and conduct in-person courses this fall.”",Planning for in-person,https://www.stmarys-ca.edu/public-safety-transportation/message-to-faculty-staff-students-about-fall-2020
St. Michael's College,Private,VT,"planning for in-person",Planning for in-person,https://www.smcvt.edu/student-life/health-and-safety/bergeron-wellness-center/health-alert-coronavirus-covid-19/
St. Olaf College,Private,MN,"considering a range of scenarios",Considering a range of scenarios,https://www.stolaf.edu/multimedia/play/?p=907
Stanford University,Private,CA,"expects to make a decision in May, but might delay fall quarter till winter",Waiting to decide,https://www.stanforddaily.com/2020/04/16/next-academic-year-could-start-in-winter-provost-says/
Stephen F. Austin State University,Public,TX,"will announce plans for fall by the end of June",Waiting to decide,http://www.sfasu.edu/life-at-sfa/health-safety/health-clinic/coronavirus/messages/20200423-campus-letter
Stetson University,Private,FL,"planning for in-person classes but will make a decision by mid to late June",Planning for in-person,https://www.stetson.edu/other/covid-19/index.php
Stevens Institute of Technology,Private,NJ,"planning a variety of scenarios",Considering a range of scenarios,https://www.stevens.edu/directory/student-health-services/health-advisory-update/coronavirus-2019-covid-19-information/advisories-updates/april-2020#042920a
Stockton University,Public,NJ,"expects a final decision by mid-July",Waiting to decide,https://stockton.edu/emergency-management/coronavirus.html
Stony Brook University,Public,NY,"expects a decision by June 30",Waiting to decide,https://www.stonybrook.edu/commcms/coronavirus/
Swarthmore College,Private,PA,"anticipates being able to share plans by June 1",Waiting to decide,https://www.swarthmore.edu/coronavirus-disease-2019-covid-19-information/planning-academic-continuity
Sweet Briar College,Private,VA,"plans to resume in-person instruction in the fall",Planning for in-person,https://sbc.edu/campus-safety/covid-19/
Syracuse University,Private,NY,"developing “multiple fall opening scenarios” with the “hope and intention that we will be welcoming students back to campus”",Considering a range of scenarios,https://news.syr.edu/blog/2020/04/16/our-plan-for-fall-2020/
Tarleton State University,Public,TX,"planning for face-to-face instruction in the fall",Planning for in-person,https://www.tarleton.edu/coronavirus/
Taylor University,Private,IN,"planning for in-person",Planning for in-person,https://www.facebook.com/watch/live/?v=472602113490213&ref=watch_permalink
Temple University,Public,PA,"expects a decision by the end of May",Waiting to decide,https://temple-news.com/temple-considering-plans-to-reopen-campus-in-fall-2020/
Texas A&M University,Public,TX,"planning for on-campus operations in the fall",Planning for in-person,https://www.tamu.edu/coronavirus/april-30-thank-you-and-plans-for-summer-fall.html
Texas Christian University,Private,TX,"planning for in-person fall classes",Planning for in-person,https://www.tcu.edu/coronavirus/index.php#campus-statement-1
Texas State University system,Public,TX,"plans to resume face-to-face instruction at its six campuses, including Lamar, Sam Houston State, Sul Ross State, and Texas State Universities",Planning for in-person,https://www.tsus.edu/newsroom/news-releases/release-050120-a.html
Texas Tech University,Public,TX,"plans to resume in-person instruction in the fall with a "phased return" that could include some in-person classes in the summer",Planning for in-person,https://www.depts.ttu.edu/communications/emergency/coronavirus/update-4-29-20.php
Texas Woman's University,Public,TX,"planning for in-person classes",Planning for in-person,https://twu.edu/news-events/news/twu-plans-to-resume-in-person-classes-in-fall/
Thomas Jefferson University,Private,PA,"planning for on-campus fall classes",Planning for in-person,https://www.jefferson.edu/coronavirus.html#updates
Transylvania University,Private,KY,"will announce fall plans in early june",Waiting to decide,https://blog.transy.edu/2020/04/message-from-interim-president-williams-to-the-transylvania-community-april-24-2020/
Trevecca Nazarene University,Private,TN,"plans to resume in-person classes unless health officials recommend otherwise",Planning for in-person,https://www.trevecca.edu/offices-services/trevecca-to-welcome-students-back-to-campus-for-the-fall-2020-semester
Trine University,Private,IN,"planning to reopen in the fall",Planning for in-person,https://www.trine.edu/news/2020/open-fall.aspx
Trinity University,Private,TX,"planning for in-person ",Planning for in-person,https://sites.google.com/trinity.edu/trinityuniversitycovid-19/community-messages/fall-semester-plans-5112020?authuser=0
Troy University,Public,AL,"will return students to campus in the fall",Planning for in-person,https://www.troy.edu/coronavirus/
Tufts University,Private,MA,"planning a range of scenarios",Considering a range of scenarios,https://coronavirus.tufts.edu/community-messages/04-24-20-academic-continuity-and-planning-for-fall-2020/
Tulane University,Private,LA,"plans to have students on-campus for fall semester",Planning for in-person,https://president.tulane.edu/view-from-gibson/finals-and-plans-fall-heroes-helpers
Union College,Private,NY,"planning for in-person",Planning for in-person,https://www.youtube.com/watch?v=YiikVDrbPpU&feature=youtu.be&utm_source=PMT+Updates&utm_campaign=6cb78e44fa-EMAIL_CAMPAIGN_2020_05_08_05_07_COPY_02&utm_medium=email&utm_term=0_8bc039f210-6cb78e44fa-491544770
Union University,Private,TN,"plans to resume face-to-face instruction in August",Planning for in-person,https://www.uu.edu/studentlife/health-services/covid-19.cfm
University of Alabama system,Public,AL,"We are expecting to have a fall semester at all of our universities," the president said. "We understand that things could happen that make it impossible, but that’s what we are planning for at this time.",Planning for in-person "University of Alaska, Anchorage",Public,AK,"proposing a hybrid model",Proposing a hybrid model,https://www.al.com/education/2020/04/university-of-alabama-planning-to-reopen-for-fall-we-fully-expect-to-have-on-campus-instruction.html
University of Arizona,Public,AZ,"intends to offer in-person classes in the fall",Planning for in-person,https://uanews.arizona.edu/story/president-robbins-uarizona-plans-resume-inperson-classes-fall
University of Arkansas System,Public,AR,"trustees approved in-person fall instruction",Planning for in-person,https://www.arkansasonline.com/news/2020/may/05/ua-trustees-ok-campus-classes-for-fall-/
University of Bridgeport,Private,CT,"planning for in-person",Planning for in-person,https://www.bridgeport.edu/covid-19/announcements
University of Buffalo,Public,NY,">planning a range of scenarios",Considering a range of scenarios,http://www.buffalo.edu/president/from-the-president/communications/Phase2.html
University of California at Berkeley,Public,CA,"Some or all classes will be delivered via remote instruction.",Proposing a hybrid model,https://sa.berkeley.edu/covid19/Fall2020
University of California at Davis,Public,CA,"proposing a hybrid model",Proposing a hybrid model "University of California, Los Angeles",Public,CA,"planning for in-person and online options",Proposing a hybrid model,https://www.davisenterprise.com/local-news/uc-davis-likely-to-offer-remote-instruction-option-in-the-fall/
University of California at San Diego,Public,CA,"intends to offer a combination of in-person and remote instruction",Proposing a hybrid model,https://coronavirus.ucsd.edu/#current-status
University of California at Santa Cruz,Public,CA,"considering a range of scenarios",Considering a range of scenarios,https://news.ucsc.edu/2020/04/information-about-fall-quarter-2020.html
University of Central Florida,Public,FL,"leaning toward in-person classes",Planning for in-person,https://twitter.com/ByBerkowitz/status/1253321140803698690
University of Central Missouri,Public,MO,"planning in-person fall classes",Planning for in-person,https://www.ucmo.edu/about/university-leadership/ucm-president/
University of Central Oklahoma,Public,OK,"planning for in-person",Planning for in-person,https://www.uco.edu/coronavirus/
University of Charleston,Private,WV,"expects campus to be open in the fall ",Planning for in-person,https://www.ucwv.edu/coronavirus-information/
University of Chicago,Private,IL,"plans to decide by the end of June",Waiting to decide,https://coronavirusupdates.uchicago.edu/apr-24-email-update/
University of Colorado at Boulder,Public,CO,"leaning toward a hybrid plan; will announce by June",Proposing a hybrid model,https://www.colorado.edu/coronavirus
University of Connecticut,Public,CT,"no decision till summer",Waiting to decide,https://www.courant.com/coronavirus/hc-news-coronavirus-uconn-fall-semester-possibly-online-20200424-tgjh2akp3rar5lqmbrbspjb744-story.html
University of Dayton,Private,OH,"“pivoting toward re-opening campus in the fall” as highest priority",Planning for in-person,https://udayton.edu/president/path-forward/index.php
University of Delaware,Public,DE,"“We remain cautiously optimistic that we will be in a position to welcome all students on campus this fall.”",Planning for in-person,https://www.udel.edu/udaily/2020/april/covid-19-response-community-letter-president-assanis/
University of Denver,Private,CO,"“We plan to reopen with face-to-face classes when we begin our fall quarter in mid-September, as long as we can do so safely and responsibly. … We will make a final decision no later than July 15.”",Planning for in-person,https://www.du.edu/coronavirus
University of Florida,Public,FL,"will announce plans by mid-July",Waiting to decide,http://www.ufl.edu/health-updates/institutional-recovery-strategy/
University of Georgia system,Public,GA,"The university plans a "phased, gradual reopening" in the summer and will resume in-person instruction during the fall 2020 semester.",Planning for in-person,https://www.redandblack.com/coronavirus/breaking-uga-anticipates-return-to-in-person-instruction-for-fall-2020/article_c1c5eb2a-8a28-11ea-a9a5-57dba27b77bc.html
University of Hawaii,Public,HI,"Planning to resume in-person instruction",Planning for in-person,https://www.staradvertiser.com/2020/05/04/breaking-news/university-of-hawaii-to-resume-in-person-instruction-for-fall-semester/
University of Houston,Public,TX,"expects a decision on fall semester in late May or early June",Waiting to decide,https://cloudapps.uh.edu/sendit/w/THVLNU3k6jqJhqMQrFvJSA/YnMQUW1VLUcjNrID5m0zPA/763892ok763J41Zk892iBU72XVwolg
University of Illinois at Urbana-Champaign,Public,IL,"We are planning for in-person classes to begin as scheduled.",Planning for in-person,https://chicago.suntimes.com/education/2020/4/24/21234508/university-of-illinois-admission-tuition-payment-financial-aid-acceptance-coronavirus-covid-19
University of Kansas,Public,KS,"“Our plan is to resume on-campus operations in some capacity this fall.”",Planning for in-person,https://coronavirus.ku.edu/sites/coronavirus.ku.edu/files/docs/Restoring%20the%20KU%20Community.pdf
University of Kentucky,Public,KY,"will announce plans by mid-June",Waiting to decide,https://www.uky.edu/coronavirus/updates/how-we-reinvent-normal-our-campus
University of La Verne,Private,CA,"“We are planning to resume face-to-face instruction and residence hall operation in the fall.”",Planning for in-person,https://laverne.edu/health/2020/fall-planning-and-budget-outlook/
University of Louisiana System,Public,LA,"planning for in-person",Planning for in-person,https://www.wafb.com/2020/05/11/ul-system-plans-resume-in-person-classes-its-schools-this-fall/
University of Lynchburg,Private,VA,"planning in-person fall classes",Planning for in-person,https://www.lynchburg.edu/about/covid-19/messages-from-president-garren/
University of Maine system,Public,ME,"planning for in-person classes",Planning for in-person,https://bangordailynews.com/2020/04/21/education/maine-universities-plan-to-reopen-campus-this-fall-but-student-life-likely-wont-be-the-same/
University of Mary,Private,ND,"intends to hold in-person classes in the fall",Planning for in-person,https://news.umary.edu/university-of-mary-announces-intention-to-resume-on-campus-classes-in-september/
University of Mary Hardin-Baylor,Private,TX,"planning for in-person",Planning for in-person,https://go.umhb.edu/coronavirus/covid-19
University of Mary Washington,Public,VA,"intends to start in-person instruction in August but says "we should also be prepared for the unknown",Planning for in-person,https://www.umw.edu/advisories/2020/04/24/fall-opening-and-tuition-freeze/
University of Maryland system,Public,MD,"planning to start in-person, but some larger classes may be online",Planning for in-person,https://www.baltimoresun.com/coronavirus/bs-md-johns-hopkins-pay-cuts-20200422-tjkj7pipj5f3xm5xc372wuao4u-story.html
University of Massachusets Amherst,Public,MA,"expects a decision in “early summer”",Waiting to decide,https://www.youtube.com/watch?v=QIiWY6mz4lY&feature=youtu.be
University of Miami,Private,FL,"Our expectation is to begin our fall semester on time and on campus, so long as we can do so safely.",Planning for in-person,https://www.youtube.com/watch?v=msSIqGafFqo
University of Michigan,Public,MI,"hoping to hold classes in-person",Planning for in-person,https://www.detroitnews.com/story/news/local/michigan/2020/04/23/um-hopes-students-campus-fall-wayne-state-michigan-state-lean-online/3013230001/
University of Minnesota,Public,MN,"considering a range of scenarios and waiting to decide",Waiting to decide,https://www.startribune.com/university-of-minnesota-budget-envisions-multiple-scenarios-for-fall-class/570293472/
University of Missouri,Public,MO,"planning for in-person classes, though the system president said he is becoming "less optimistic" about fully opening in the fall",Proposing a hybrid model,https://abc17news.com/news/coronavirus/2020/04/22/wednesday-updates-columbia-college-student-tests-positive-for-covid-19/
University of Missouri at Kansas City,Public,MO,"expects to be on campus in the fall",Planning for in-person,https://www.umkc.edu/news/posts/2020/april/we-are-rooready-for-fall-semester-classes.html
University of Mobile,Private,AL,"“plans to resume on-ground instruction and residential housing this fall”",Planning for in-person,https://umobile.edu/news/university-of-mobile-plans-to-return-to-on-campus-instruction-in-fall/
University of Montana,Public,MT,"planning for in-person",Planning for in-person,https://www.umt.edu/coronavirus/communications/may7_president.php
University of Montevallo,Public,AL,"planning for in-person",Planning for in-person,https://www.montevallo.edu/about-um/marcomm/coronavirus-information/may-1/
University of Nebraska system,Public,NE,"The system "expects to hold classes on its campuses in the fall." The chancellor of the flagship University of Nebraska at Lincoln wrote in a letter on April 24, "UNL will be open in the fall for in-person instruction," taking public-health guidance, safety, and social distancing into account.",Planning for in-person "University of Nevada, Reno",Public,NV," planning for in-person fall classes",Planning for in-person,https://www.omaha.com/news/education/unl-expects-to-hold-on-campus-classes-in-the-fall-chancellor-says/article_3c549fae-b83e-5dce-b4e4-bf159513b178.html
University of New England,Private,ME,"planning to reopen campus in the fall",Planning for in-person,https://www.une.edu/news/2020/university-new-england-announces-plans-open-maine-campuses-fall-semester
University of New Hampshire,Public,NH,"planning for in-person",Planning for in-person,https://www.unh.edu/president/person-instruction-resume-fall-semester
University of New Haven,Private,CT,"intends to bring students back to campus in August, but is also “exploring academic contingencies for a variety of scenarios”",Considering a range of scenarios,https://www.newhaven.edu/coronavirus-info.php#notifications
University of North Carolina at Asheville,Private,NC,"planning for in-person instruction",Planning for in-person,https://coronavirus.unca.edu/resources/academics/
University of North Carolina at Chapel Hill,Public,NC,"optimistic for on-campus classes this fall, but still considering a variety of options",Planning for in-person,https://www.newsobserver.com/news/local/education/article242316001.html
University of North Carolina at Charlotte,Public,NC,"will begin fall semester two weeks later than planned",Planning for in-person,https://emergency.uncc.edu/health-advisories/coronavirus-information/coronavirus-campus-updates
University of North Carolina at Greensboro,Public,NC,"expects to start fall semester in-person",Planning for in-person,https://update.uncg.edu/uncg-outlook-for-fall-2020/
University of North Carolina at Pembroke,Public,NC,"We fully expect and it is our present intention to be back in our classrooms, labs, and offices this fall.",Planning for in-person,https://www.uncp.edu/news/uncp-plans-fall-2020-operations
University of Northern Colorado,Public,CO,"planning to return to campus in the fall",Planning for in-person,https://www.unco.edu/coronavirus/messages/planning-fall-semester.aspx
University of North Texas,Public,TX,"planning on safely resuming campus learning and residential life for fall 2020.",Planning for in-person,https://www.unt.edu/notices/planning-be-together-again-our-beautiful-campus-message-president
University of Notre Dame,Private,IN,"will announce plans by mid-June",Waiting to decide,https://ndsmcobserver.com/2020/04/notre-dame-to-announce-fall-semester-plans-mid-june/
University of Oklahoma,Public,OK,"Our intention is to return to in-person educational operations on all three campuses by this fall, offering traditional instruction and residential life.",Planning for in-person,http://www.ou.edu/web/news_events/articles/news_2020/letter-from-interim-president-harroz-fall-semester-plans
University of Oregon,Public,OR,"The university is aiming for in-person instruction in the fall, but the president says "it is unlikely that our fall quarter will look just like last fall.",Planning for in-person,https://around.uoregon.edu/content/uo-making-plans-campus-instruction-fall-term
